Date,Winner1,Winner Probability,Loser1,Loser Probability,Site,Category,hot_score
2024-03-03,Minnesota Wild,82.5%,San Jose Sharks,17.5%,Playing At:  Minnesota Wild   Home,80-85,0.07142857142857106
2024-03-03,Vancouver Canucks,69.5%,Anaheim Ducks,30.5%,Playing At:  Anaheim Ducks   Home,60-70,-0.9285714285714289
2024-03-03,Edmonton Oilers,68.3%,Pittsburgh Penguins,31.7%,Playing At:  Edmonton Oilers   Home,60-70,0.7857142857142856
2024-03-03,Washington Capitals,62.9%,Arizona Coyotes,37.1%,Playing At:  Washington Capitals   Home,60-70,1.9285714285714288
2024-03-03,Winnipeg Jets,55.2%,Buffalo Sabres,44.8%,Playing At:  Buffalo Sabres   Home,55-60,1.3571428571428574
2024-03-03,Los Angeles Kings,53.3%,New Jersey Devils,46.7%,Playing At:  Los Angeles Kings   Home,55 >,1.25
