Date,Winner1,Winner Probability,Loser1,Loser Probability,Site,Category,hot_score
2024-03-17,Winnipeg Jets,76.00%,Columbus Blue Jackets,24.00%,Playing At:  Columbus Blue Jackets   Home,75-80,0.875
2024-03-17,New York Rangers,72.87%,New York Islanders,27.13%,Playing At:  New York Rangers   Home,70-75,1.214285714285714
2024-03-17,St. Louis Blues,68.91%,Anaheim Ducks,31.09%,Playing At:  St. Louis Blues   Home,60-70,0.875
2024-03-17,Carolina Hurricanes,65.48%,Ottawa Senators,34.52%,Playing At:  Ottawa Senators   Home,60-70,-0.25
2024-03-17,Chicago Blackhawks,64.02%,San Jose Sharks,35.98%,Playing At:  Chicago Blackhawks   Home,60-70,-0.3571428571428573
2024-03-17,Vegas Golden Knights,55.91%,New Jersey Devils,44.09%,Playing At:  Vegas Golden Knights   Home,55-60,-1.5
2024-03-17,Detroit Red Wings,55.44%,Pittsburgh Penguins,44.56%,Playing At:  Pittsburgh Penguins   Home,55-60,-2.166666666666667
