Date,Winner1,Winner Probability,Loser1,Loser Probability,Site,Category,hot_score
2024-02-20,Los Angeles Kings,75.98%,Columbus Blue Jackets,24.02%,Playing At:  Los Angeles Kings   Home,75-80,1.1
2024-02-20,Pittsburgh Penguins,62.49%,New York Islanders,37.51%,Playing At:  Pittsburgh Penguins   Home,60-70,0.16666666666666663
2024-02-20,Florida Panthers,61.54%,Ottawa Senators,38.46%,Playing At:  Florida Panthers   Home,60-70,4.333333333333334
2024-02-20,New Jersey Devils,60.78%,Washington Capitals,39.22%,Playing At:  Washington Capitals   Home,60-70,-0.6666666666666669
2024-02-20,Winnipeg Jets,59.43%,Minnesota Wild,40.57%,Playing At:  Winnipeg Jets   Home,55-60,0.30000000000000004
2024-02-20,New York Rangers,56.03%,Dallas Stars,43.97%,Playing At:  New York Rangers   Home,55-60,3.1666666666666665
2024-02-20,Colorado Avalanche,54.89%,Vancouver Canucks,45.11%,Playing At:  Colorado Avalanche   Home,55 >,-1.2142857142857142
2024-02-20,Vegas Golden Knights,51.04%,Nashville Predators,48.96%,Playing At:  Vegas Golden Knights   Home,55 >,0.25
