Date,Winner1,Winner Probability,Loser1,Loser Probability,Site,Category,hot_score
2024-04-16,Carolina Hurricanes,77.6700%,Columbus Blue Jackets,22.3300%,Playing At:  Columbus Blue Jackets   Home,75-80,-0.9285714285714286
2024-04-16,Boston Bruins,77.2212%,Ottawa Senators,22.7788%,Playing At:  Boston Bruins   Home,75-80,2.3
2024-04-16,Vegas Golden Knights,76.2042%,Chicago Blackhawks,23.7958%,Playing At:  Vegas Golden Knights   Home,75-80,0.666666666666667
2024-04-16,Vancouver Canucks,66.0007%,Calgary Flames,33.9993%,Playing At:  Vancouver Canucks   Home,60-70,0.3571428571428572
2024-04-16,Philadelphia Flyers,58.8159%,Washington Capitals,41.1841%,Playing At:  Philadelphia Flyers   Home,55-60,-1.3333333333333335
2024-04-16,Detroit Red Wings,56.1930%,Montreal Canadiens,43.8070%,Playing At:  Montreal Canadiens   Home,55-60,-0.2142857142857142
2024-04-16,Winnipeg Jets,56.1859%,Seattle Kraken,43.8141%,Playing At:  Winnipeg Jets   Home,55-60,4.333333333333333
2024-04-16,Florida Panthers,52.1039%,Toronto Maple Leafs,47.8961%,Playing At:  Florida Panthers   Home,55 >,1.7857142857142856
